{
  "schema_version": "2.0.0",
  "metric_id": "METRIC-BLOCKED",
  "run_id": "RUN-BLOCKED-001",
  "case_id": "LAT-FIRST-001",
  "name": "e2e_first_audio_latency_ms",
  "definition_version": "1.0.0",
  "execution_kind": "synthetic",
  "value": null,
  "unit": "ms",
  "status": "insufficient_evidence",
  "measurement_scope": "black_box",
  "method": "deterministic",
  "confidence": 0,
  "evidence_ids": [],
  "event_ids": [],
  "aggregation": {
    "kind": "single",
    "sample_count": 0,
    "total_count": 1,
    "excluded_count": 1,
    "algorithm": "single",
    "input_metric_ids": []
  },
  "reason": "No recorded device output; cannot calculate latency"
}
